{
  "schema_version": 1,
  "plan_id": "OWNER_TO_ASSIGN_BEFORE_EMPIRICAL_ACCESS",
  "research_hypothesis": "The frozen Phase 6 candidate has positive net expectancy after Phase 7 costs on untouched XAUUSDm data.",
  "strategy_fingerprint": "PHASE6_FROZEN_FINGERPRINT_FROM_DOCUMENTATION",
  "execution_fingerprint": "PHASE7_EXECUTION_FINGERPRINT_FROM_DOCUMENTATION",
  "risk_policy_version": "phase4-validation-v1",
  "initial_capital": 1000.0,
  "dataset_hash": "OWNER_TO_REPLACE_WITH_ACCEPTED_PACKAGE_HASH",
  "development_period": {"name": "development", "start": "OWNER_UTC_START", "end": "OWNER_UTC_END"},
  "validation_period": {"name": "walk_forward_validation", "start": "OWNER_UTC_START", "end": "OWNER_UTC_END"},
  "final_holdout": {"name": "untouched_final_holdout", "start": "OWNER_UTC_START", "end": "OWNER_UTC_END"},
  "walk_forward_mode": "ANCHORED",
  "fold_count": 4,
  "purge_seconds": 86400,
  "embargo_seconds": 86400,
  "warmup_seconds": 2419200,
  "primary_metrics": ["net_expectancy", "net_profit_factor", "maximum_executable_equity_drawdown"],
  "secondary_metrics": ["win_rate", "expectancy_r", "cost_ratio", "regime_stability", "concentration"],
  "acceptance_policy_version": "phase8a-acceptance-v1",
  "stress_scenarios": ["cost_x_1.25", "cost_x_1.50", "cost_x_2.00", "entry_latency", "missed_trades", "data_gaps", "loss_clusters", "minimum_lot", "metadata_change"],
  "sensitivity_spec": {"confluence_threshold": [0.9, 0.95, 1.05, 1.1], "stop_distance": [0.9, 0.95, 1.05, 1.1], "cost_level": [1.0, 1.25, 1.5, 2.0]},
  "statistical_procedures": ["moving_block_bootstrap", "block_length_sensitivity", "path_dependent_equity_resimulation"],
  "random_seeds": [8001],
  "permitted_candidate_ids": ["phase6-frozen-v1"],
  "maximum_trials": 1,
  "invalidation_conditions": ["dataset_hash_changed", "strategy_changed_after_holdout", "execution_model_changed", "holdout_rerun_without_authorization", "causal_invariant_failed"],
  "finalized_at": "OWNER_UTC_FINALIZATION_TIMESTAMP"
}
